{"$schema":"https://json-schema.org/draft/2020-12/schema","$id":"https://github.com/directsoundrecords/resonance-lab-measurements/blob/main/data/schema/measurement.schema.json","title":"DSR Resonance Lab Measurement Record","description":"Schema for public turntable setup observations created with Resonance Lab and published by Direct Sound Records.","type":"object","required":["schema_version","measurement_id","setup_id","record_version","publication_status","title","creator","publisher","software","measurement_type","measurement_scope","setup","conditions","results","interpretation","provenance","license","keywords"],"properties":{"$schema":{"type":"string"},"schema_version":{"const":"1.0.0"},"measurement_id":{"type":"string","pattern":"^RL-[0-9]{4}-[0-9]{4,}$","description":"Immutable Resonance Lab measurement/session identifier."},"setup_id":{"type":"string","pattern":"^DSR-SETUP-[0-9]{4,}$","description":"Stable identity for the physical playback setup, reusable across Resonance Lab and Groove Scope."},"record_version":{"type":"string","pattern":"^[0-9]+\\.[0-9]+\\.[0-9]+$"},"publication_status":{"type":"string","enum":["draft","published","superseded","withdrawn"]},"title":{"type":"string","minLength":3},"slug":{"type":"string"},"language":{"type":"string","default":"en"},"measurement_datetime_local":{"type":["string","null"]},"measurement_timezone":{"$ref":"#/$defs/stateOrString"},"date_published":{"type":["string","null"],"format":"date"},"creator":{"type":"object","required":["name","affiliation"],"properties":{"name":{"type":"string"},"role":{"type":"string"},"affiliation":{"type":"string"}},"additionalProperties":true},"publisher":{"type":"object","required":["name","url"],"properties":{"name":{"type":"string"},"url":{"type":"string","format":"uri"},"location_label":{"type":"string"}},"additionalProperties":true},"software":{"type":"object","required":["name","application_version","analysis_method_version","platform"],"properties":{"name":{"const":"Resonance Lab"},"application_version":{"$ref":"#/$defs/stateOrString"},"analysis_method_version":{"$ref":"#/$defs/stateOrString"},"platform":{"$ref":"#/$defs/stateOrString"},"developer":{"type":"string"}},"additionalProperties":true},"related_applications":{"type":"array","items":{"type":"object","required":["name","relationship"],"properties":{"name":{"type":"string"},"relationship":{"type":"string"},"url":{"type":"string","format":"uri"}},"additionalProperties":true}},"related_measurements":{"type":"array","description":"Links to other RL or GS measurement IDs for the same or related setup.","items":{"type":"object","required":["measurement_id","relationship"],"properties":{"measurement_id":{"type":"string","pattern":"^(RL|GS)-[0-9]{4}-[0-9]{4,}$"},"relationship":{"type":"string"},"url":{"type":"string","format":"uri"}},"additionalProperties":true}},"measurement_type":{"type":"string","enum":["turntable_setup_observation","resonance_prediction","rpm_measurement","vibration_measurement","combined_setup_analysis"]},"measurement_scope":{"type":"array","minItems":1,"uniqueItems":true,"items":{"type":"string","enum":["setup_metadata","resonance_prediction","rpm","wow_flutter","vibration","combined_analysis","stylus_usage_snapshot"]}},"setup":{"$ref":"#/$defs/setup"},"conditions":{"$ref":"#/$defs/conditions"},"results":{"$ref":"#/$defs/results"},"interpretation":{"type":"object","required":["summary"],"properties":{"summary":{"type":"string"},"recommendation":{"type":["string","null"]},"repeat_required":{"type":["boolean","null"]},"comparison_limitations":{"type":"array","items":{"type":"string"}}},"additionalProperties":true},"provenance":{"type":"object","required":["source_type","data_entry_method","known_limitations"],"properties":{"source_type":{"type":"string"},"source_file":{"$ref":"#/$defs/stateOrString"},"data_entry_method":{"type":"string"},"known_limitations":{"type":"array","items":{"type":"string"}},"setup_metadata_source":{"type":["string","null"]},"raw_sensor_data_published":{"type":"boolean"},"raw_sensor_data_note":{"type":["string","null"]}},"additionalProperties":true},"files":{"type":"object","properties":{"human_readable_record":{"type":"string"},"measurement_json":{"type":"string"},"rpm_series_csv":{"$ref":"#/$defs/stateOrString"},"rpm_spectrum_csv":{"$ref":"#/$defs/stateOrString"},"vibration_series_csv":{"$ref":"#/$defs/stateOrString"},"vibration_spectrum_csv":{"$ref":"#/$defs/stateOrString"},"source_report":{"$ref":"#/$defs/stateOrString"},"checksums":{"$ref":"#/$defs/stateOrString"},"images":{"type":"array","items":{"type":"string"}}},"additionalProperties":true},"license":{"type":"string"},"keywords":{"type":"array","minItems":1,"items":{"type":"string"}}},"$defs":{"state":{"type":"string","enum":["not_recorded","not_applicable","not_available","not_confirmed"]},"stateOrString":{"type":"string","minLength":1,"description":"A recorded string value or an explicit state such as not_recorded, not_applicable, not_available or not_confirmed."},"numberOrState":{"oneOf":[{"type":"number"},{"$ref":"#/$defs/state"}]},"booleanOrState":{"oneOf":[{"type":"boolean"},{"$ref":"#/$defs/state"}]},"component":{"type":"object","required":["manufacturer","model"],"properties":{"manufacturer":{"$ref":"#/$defs/stateOrString"},"model":{"$ref":"#/$defs/stateOrString"},"serial_number":{"$ref":"#/$defs/stateOrString"}},"additionalProperties":true},"setup":{"type":"object","required":["turntable","tonearm","cartridge","support"],"properties":{"setup_name":{"type":["string","null"]},"turntable":{"allOf":[{"$ref":"#/$defs/component"},{"type":"object","properties":{"drive_type":{"oneOf":[{"type":"string","enum":["belt","direct","idler","other"]},{"$ref":"#/$defs/state"}]},"suspension_type":{"oneOf":[{"type":"string","enum":["suspended","non_suspended","other"]},{"$ref":"#/$defs/state"}]},"platter_mat":{"$ref":"#/$defs/stateOrString"},"clamp_or_weight":{"$ref":"#/$defs/stateOrString"}}}]},"tonearm":{"allOf":[{"$ref":"#/$defs/component"},{"type":"object","properties":{"effective_mass_g":{"$ref":"#/$defs/numberOrState"},"headshell":{"$ref":"#/$defs/stateOrString"},"headshell_mass_g":{"$ref":"#/$defs/numberOrState"},"damping":{"$ref":"#/$defs/stateOrString"}}}]},"cartridge":{"allOf":[{"$ref":"#/$defs/component"},{"type":"object","properties":{"stylus":{"$ref":"#/$defs/stateOrString"},"cartridge_mass_g":{"$ref":"#/$defs/numberOrState"},"mounting_hardware_mass_g":{"$ref":"#/$defs/numberOrState"},"vertical_tracking_force_g":{"$ref":"#/$defs/numberOrState"},"anti_skate_setting":{"$ref":"#/$defs/stateOrString"},"alignment_geometry":{"$ref":"#/$defs/stateOrString"},"azimuth_setting":{"$ref":"#/$defs/stateOrString"},"vta_or_sra_setting":{"$ref":"#/$defs/stateOrString"},"stylus_usage_hours_at_measurement":{"$ref":"#/$defs/numberOrState"},"compliance":{"type":"object","properties":{"published_value_um_mn":{"$ref":"#/$defs/numberOrState"},"published_reference_frequency_hz":{"$ref":"#/$defs/numberOrState"},"calculation_value_um_mn":{"$ref":"#/$defs/numberOrState"},"conversion_applied":{"$ref":"#/$defs/booleanOrState"},"conversion_note":{"type":["string","null"]},"source":{"$ref":"#/$defs/stateOrString"}},"additionalProperties":true}}}]},"support":{"type":"object","required":["support_type"],"properties":{"support_type":{"oneOf":[{"type":"string","enum":["floor_stand","equipment_rack","wall_shelf","dedicated_platform","furniture","other"]},{"$ref":"#/$defs/state"}]},"description":{"$ref":"#/$defs/stateOrString"},"isolation_devices":{"$ref":"#/$defs/stateOrString"},"floor_type":{"$ref":"#/$defs/stateOrString"}},"additionalProperties":true}},"additionalProperties":true},"conditions":{"type":"object","required":["device","phone_placement","operating_state"],"properties":{"device":{"type":"object","required":["model"],"properties":{"model":{"$ref":"#/$defs/stateOrString"},"os_version":{"$ref":"#/$defs/stateOrString"},"sensor_notes":{"type":["string","null"]}},"additionalProperties":true},"phone_placement":{"type":"object","required":["location_on_system"],"properties":{"location_on_system":{"oneOf":[{"type":"string","enum":["platter","turntable_plinth","turntable_top_plate","turntable_support","equipment_rack","floor","other"]},{"$ref":"#/$defs/state"}]},"orientation":{"$ref":"#/$defs/stateOrString"},"placement_notes":{"type":["string","null"]}},"additionalProperties":true},"operating_state":{"type":"object","properties":{"motor_on":{"$ref":"#/$defs/booleanOrState"},"platter_rotating":{"$ref":"#/$defs/booleanOrState"},"target_rpm":{"$ref":"#/$defs/numberOrState"},"record_present":{"$ref":"#/$defs/booleanOrState"},"stylus_tracking":{"$ref":"#/$defs/booleanOrState"},"speakers_active":{"$ref":"#/$defs/booleanOrState"},"playback_level_note":{"$ref":"#/$defs/stateOrString"}},"additionalProperties":true},"measurement_duration_s":{"$ref":"#/$defs/numberOrState"},"repeat_number":{"type":["integer","null"],"minimum":1},"measurement_location_label":{"$ref":"#/$defs/stateOrString"},"environment_notes":{"type":["string","null"]}},"additionalProperties":true},"results":{"type":"object","properties":{"resonance_prediction":{"type":["object","null"],"properties":{"analysis_method_version":{"$ref":"#/$defs/stateOrString"},"effective_mass_g":{"$ref":"#/$defs/numberOrState"},"cartridge_mass_g":{"$ref":"#/$defs/numberOrState"},"mounting_hardware_mass_g":{"$ref":"#/$defs/numberOrState"},"compliance_used_um_mn":{"$ref":"#/$defs/numberOrState"},"predicted_resonance_hz":{"$ref":"#/$defs/numberOrState"},"reference_region_hz":{"type":"object","properties":{"lower":{"type":"number"},"upper":{"type":"number"}},"required":["lower","upper"]},"classification":{"oneOf":[{"type":"string","enum":["below_reference","within_reference","above_reference","informational"]},{"$ref":"#/$defs/state"}]},"notes":{"type":["string","null"]}},"additionalProperties":true},"rpm":{"type":["object","null"],"properties":{"analysis_method_version":{"$ref":"#/$defs/stateOrString"},"target_rpm":{"$ref":"#/$defs/numberOrState"},"average_rpm":{"$ref":"#/$defs/numberOrState"},"speed_error_percent":{"$ref":"#/$defs/numberOrState"},"speed_error_rpm":{"$ref":"#/$defs/numberOrState"},"peak_deviation_positive_percent":{"$ref":"#/$defs/numberOrState"},"peak_deviation_negative_percent":{"$ref":"#/$defs/numberOrState"},"speed_standard_deviation_rpm":{"$ref":"#/$defs/numberOrState"},"test_duration_s":{"$ref":"#/$defs/numberOrState"},"wow_rms_percent":{"$ref":"#/$defs/numberOrState"},"wow_band_hz":{"type":"object","properties":{"lower":{"type":"number"},"upper":{"type":"number"}},"required":["lower","upper"]},"flutter_rms_percent":{"$ref":"#/$defs/numberOrState"},"flutter_band_hz":{"type":"object","properties":{"lower":{"type":"number"},"upper":{"type":"number"}},"required":["lower","upper"]},"wow_flutter_rms_percent":{"$ref":"#/$defs/numberOrState"},"wow_flutter_band_hz":{"type":"object","properties":{"lower":{"type":"number"},"upper":{"type":"number"}},"required":["lower","upper"]},"weighting":{"oneOf":[{"type":"string","enum":["unweighted"]},{"$ref":"#/$defs/state"}]},"spectrum_file":{"$ref":"#/$defs/stateOrString"},"series_file":{"$ref":"#/$defs/stateOrString"},"notes":{"type":["string","null"]}},"additionalProperties":true},"vibration":{"type":["object","null"],"properties":{"analysis_method_version":{"$ref":"#/$defs/stateOrString"},"analysis_range_hz":{"type":"object","properties":{"lower":{"type":"number"},"upper":{"type":"number"}},"required":["lower","upper"]},"capture_rms_mg":{"$ref":"#/$defs/numberOrState"},"capture_peak_mg":{"$ref":"#/$defs/numberOrState"},"test_duration_s":{"$ref":"#/$defs/numberOrState"},"bands":{"type":"array","items":{"type":"object","required":["label","lower_hz","upper_hz","energy_percent","rms_mg"],"properties":{"label":{"type":"string"},"lower_hz":{"type":"number"},"upper_hz":{"type":"number"},"energy_percent":{"$ref":"#/$defs/numberOrState"},"rms_mg":{"$ref":"#/$defs/numberOrState"}},"additionalProperties":true}},"dominant_peaks":{"type":"array","items":{"type":"object","required":["frequency_hz"],"properties":{"frequency_hz":{"type":"number"},"amplitude_mg":{"$ref":"#/$defs/numberOrState"},"classification":{"type":["string","null"]}},"additionalProperties":true}},"distinct_peak_detected":{"$ref":"#/$defs/booleanOrState"},"spectrum_file":{"$ref":"#/$defs/stateOrString"},"series_file":{"$ref":"#/$defs/stateOrString"},"notes":{"type":["string","null"]}},"additionalProperties":true},"stylus_usage_snapshot":{"type":["object","null"],"properties":{"usage_hours":{"$ref":"#/$defs/numberOrState"},"recorded_at":{"type":["string","null"]},"tracking_source":{"$ref":"#/$defs/stateOrString"}},"additionalProperties":true},"combined_analysis":{"type":["object","null"],"description":"Contextual relationship between predicted arm/cartridge resonance and measured mechanical vibration. These are not the same measurement.","properties":{"analysis_method_version":{"$ref":"#/$defs/stateOrString"},"predicted_resonance_hz":{"$ref":"#/$defs/numberOrState"},"comparison_window_hz":{"type":["object","null"],"properties":{"lower":{"type":"number"},"upper":{"type":"number"}}},"measured_energy_near_prediction":{"type":["object","null"],"properties":{"rms_mg":{"$ref":"#/$defs/numberOrState"},"energy_percent":{"$ref":"#/$defs/numberOrState"}},"additionalProperties":true},"assessment":{"oneOf":[{"type":"string","enum":["not_assessed","low_overlap","moderate_overlap","high_overlap","informational"]},{"$ref":"#/$defs/state"}]},"interpretation":{"type":["string","null"]},"limitation":{"type":["string","null"],"default":"Vibration measured at the phone placement point is not a direct measurement of cartridge/tonearm resonance."}},"additionalProperties":true}},"additionalProperties":true}},"additionalProperties":true}