{"$schema":"../../data/schema/measurement.schema.json","schema_version":"1.0.0","measurement_id":"RL-2026-0001","setup_id":"DSR-SETUP-0001","record_version":"0.1.0","publication_status":"draft","title":"Example turntable setup observation","slug":"rl-2026-0001-example-turntable-setup-observation","language":"en","measurement_datetime_local":null,"measurement_timezone":"not_recorded","date_published":null,"creator":{"name":"Michelangelo Canonico","role":"Creator and lead measurer","affiliation":"Direct Sound Records"},"publisher":{"name":"Direct Sound Records","url":"https://directsoundrecords.com/","location_label":"London–Rome"},"software":{"name":"Resonance Lab","application_version":"not_recorded","analysis_method_version":"not_recorded","platform":"iOS","developer":"Direct Sound Records"},"related_applications":[{"name":"Groove Scope","relationship":"Companion application for electrical/audio playback measurements","url":"https://directsoundrecords.com/"}],"related_measurements":[],"measurement_type":"turntable_setup_observation","measurement_scope":["setup_metadata","resonance_prediction","rpm","wow_flutter","vibration","combined_analysis","stylus_usage_snapshot"],"setup":{"setup_name":null,"turntable":{"manufacturer":"not_recorded","model":"not_recorded","serial_number":"not_recorded","drive_type":"not_recorded","suspension_type":"not_recorded","platter_mat":"not_recorded","clamp_or_weight":"not_recorded"},"tonearm":{"manufacturer":"not_recorded","model":"not_recorded","serial_number":"not_recorded","effective_mass_g":"not_recorded","headshell":"not_recorded","headshell_mass_g":"not_recorded","damping":"not_recorded"},"cartridge":{"manufacturer":"not_recorded","model":"not_recorded","serial_number":"not_recorded","stylus":"not_recorded","cartridge_mass_g":"not_recorded","mounting_hardware_mass_g":"not_recorded","vertical_tracking_force_g":"not_recorded","anti_skate_setting":"not_recorded","alignment_geometry":"not_recorded","azimuth_setting":"not_recorded","vta_or_sra_setting":"not_recorded","stylus_usage_hours_at_measurement":"not_recorded","compliance":{"published_value_um_mn":"not_recorded","published_reference_frequency_hz":"not_recorded","calculation_value_um_mn":"not_recorded","conversion_applied":"not_recorded","conversion_note":null,"source":"not_recorded"}},"support":{"support_type":"not_recorded","description":"not_recorded","isolation_devices":"not_recorded","floor_type":"not_recorded"}},"conditions":{"device":{"model":"not_recorded","os_version":"not_recorded","sensor_notes":null},"phone_placement":{"location_on_system":"not_recorded","orientation":"not_recorded","placement_notes":null},"operating_state":{"motor_on":"not_recorded","platter_rotating":"not_recorded","target_rpm":"not_recorded","record_present":"not_recorded","stylus_tracking":"not_recorded","speakers_active":"not_recorded","playback_level_note":"not_recorded"},"measurement_duration_s":"not_recorded","repeat_number":1,"measurement_location_label":"not_recorded","environment_notes":null},"results":{"resonance_prediction":{"analysis_method_version":"not_recorded","effective_mass_g":"not_recorded","cartridge_mass_g":"not_recorded","mounting_hardware_mass_g":"not_recorded","compliance_used_um_mn":"not_recorded","predicted_resonance_hz":"not_recorded","reference_region_hz":{"lower":8.0,"upper":12.0},"classification":"not_recorded","notes":null},"rpm":{"analysis_method_version":"not_recorded","target_rpm":"not_recorded","average_rpm":"not_recorded","speed_error_percent":"not_recorded","speed_error_rpm":"not_recorded","peak_deviation_positive_percent":"not_recorded","peak_deviation_negative_percent":"not_recorded","speed_standard_deviation_rpm":"not_recorded","test_duration_s":"not_recorded","wow_rms_percent":"not_recorded","wow_band_hz":{"lower":0.5,"upper":6.0},"flutter_rms_percent":"not_recorded","flutter_band_hz":{"lower":6.0,"upper":20.0},"wow_flutter_rms_percent":"not_recorded","wow_flutter_band_hz":{"lower":0.5,"upper":20.0},"weighting":"unweighted","spectrum_file":"not_available","series_file":"not_available","notes":null},"vibration":{"analysis_method_version":"not_recorded","analysis_range_hz":{"lower":1.0,"upper":40.0},"capture_rms_mg":"not_recorded","capture_peak_mg":"not_recorded","test_duration_s":"not_recorded","bands":[{"label":"low","lower_hz":1.0,"upper_hz":8.0,"energy_percent":"not_recorded","rms_mg":"not_recorded"},{"label":"mid","lower_hz":8.0,"upper_hz":20.0,"energy_percent":"not_recorded","rms_mg":"not_recorded"},{"label":"high","lower_hz":20.0,"upper_hz":40.0,"energy_percent":"not_recorded","rms_mg":"not_recorded"}],"dominant_peaks":[],"distinct_peak_detected":"not_recorded","spectrum_file":"not_available","series_file":"not_available","notes":null},"stylus_usage_snapshot":{"usage_hours":"not_recorded","recorded_at":null,"tracking_source":"Resonance Lab"},"combined_analysis":{"analysis_method_version":"not_recorded","predicted_resonance_hz":"not_recorded","comparison_window_hz":null,"measured_energy_near_prediction":null,"assessment":"not_assessed","interpretation":null,"limitation":"Vibration measured at the phone placement point is not a direct measurement of cartridge/tonearm resonance."}},"interpretation":{"summary":"Draft record awaiting measurement data.","recommendation":null,"repeat_required":null,"comparison_limitations":[]},"provenance":{"source_type":"Resonance Lab measurement/export","source_file":"not_available","data_entry_method":"Structured record created from Resonance Lab results and documented setup metadata.","known_limitations":["Draft template contains unrecorded fields and must not be treated as a published measurement."],"setup_metadata_source":null,"raw_sensor_data_published":false,"raw_sensor_data_note":"Raw sensor time series are optional and are not required for a valid public summary record."},"files":{"human_readable_record":"README.md","measurement_json":"measurement.json","rpm_series_csv":"not_available","rpm_spectrum_csv":"not_available","vibration_series_csv":"not_available","vibration_spectrum_csv":"not_available","source_report":"not_available","checksums":"checksums.sha256","images":[]},"license":"CC-BY-4.0","keywords":["Resonance Lab","Direct Sound Records","turntable measurement","tonearm cartridge resonance","turntable RPM","wow and flutter","turntable vibration","stylus usage"]}